{
  "$schema": "https://json-schema.org/draft/2020-12/schema",
  "$id": "safety-clearance.schema.json",
  "title": "SafetyClearance",
  "description": "The manifest that must exist, verify, and be COMPLETE before anything leaves the device or reaches a printer. Designed by Codex on issue #21; this is the contract form of it.\n\nWHY A MANIFEST AND NOT A FIELD ON EACH RECORD\n\nA per-record `is_safe` flag is checked at some point and acted on at another, and the gap between them is where the failure lives: the selection changes, a photo is swapped in, and the check that passed was about a different set. So clearance is bound to an EXACT publication -- this sink, these media ids, in this order, under this classifier and this config digest -- and hashed. The renderer or service verifies the hash against the inputs it is ACTUALLY about to publish, inside the same operation that creates the export. There is no window in which the checked set and the published set can differ.\n\nTHE RULE THAT MATTERS MOST\n\nAbsence is `indeterminate`, and indeterminate BLOCKS. A missing verdict, an unloadable classifier, a config digest mismatch, an inference timeout, a stale verdict for a proxy that has since changed, a row that simply is not there -- all of them are indeterminate. Only `cleared` proceeds.\n\nThis is the opposite of how safety checks usually fail. The common shape is a check that silently no-ops when its model is missing, so everything downstream reads the absence as a pass. This project has already shipped one gate with exactly that defect (a model load gate that permitted weights whose hash had never been computed), and the fix cost more than building it correctly would have.\n\nWHAT MAY AND MAY NOT BE OVERRIDDEN\n\nA POSITIVE classifier result may be overridden per item by a human: a parent may decide a breastfeeding photo belongs in the family album, and the classifier does not get a veto over that. The override is recorded in the manifest with who and when, so the decision is attributable.\n\nA MISSING result may NOT be overridden -- not by a flag, not by a default, not by a global bypass, not by an empty override list. 'Nobody checked' and 'somebody checked and disagreed' are different states, and only the second is a decision.",
  "type": "object",
  "additionalProperties": false,
  "required": [
    "schema_version",
    "manifest_id",
    "manifest_version",
    "created_at",
    "sink",
    "classifier",
    "thresholds",
    "items",
    "decision"
  ],
  "properties": {
    "schema_version": {
      "$ref": "common.schema.json#/$defs/SchemaVersion"
    },
    "manifest_id": {
      "description": "BLAKE3 over the canonical manifest body, computed exactly as models/policy/digest.py computes a config digest: over the SERIALISED BYTES of this document with `manifest_id` and `decision` removed. Bytes rather than a re-serialisation, because Python writes the float 1.0 as `1.0` and JavaScript writes `1`, and a manifest that verifies in the pipeline and fails in the Rust renderer is a gate that blocks correct output -- which is how gates get disabled.",
      "$ref": "common.schema.json#/$defs/Blake3Hash"
    },
    "manifest_version": {
      "description": "Format version of the manifest itself. A verifier that does not recognise this value MUST DENY rather than attempt a best-effort parse. Deny-by-default on an unknown version is what stops an old renderer from ignoring a field a newer planner added -- and the field it ignores will be the one that was added because something went wrong.",
      "type": "integer",
      "const": 1
    },
    "created_at": {
      "$ref": "common.schema.json#/$defs/Timestamp"
    },
    "sink": {
      "description": "Where this publication is going. Clearance is NOT transferable between sinks: a photo cleared for a private printed book has not thereby been cleared for a public share link, and the thresholds differ. A verifier must check that the sink it is serving matches this value exactly.",
      "type": "string",
      "enum": [
        "print",
        "share",
        "frontier_egress",
        "local_export"
      ]
    },
    "sink_detail": {
      "description": "Free text naming the specific destination (vendor, recipient scope, model provider) for the audit trail. NEVER parsed, never used to make a decision -- a decision that depends on a free-text field is a decision an attacker can influence.",
      "oneOf": [
        {
          "type": "string",
          "maxLength": 512
        },
        {
          "type": "null"
        }
      ]
    },
    "classifier": {
      "$ref": "#/$defs/ClassifierPin"
    },
    "thresholds": {
      "$ref": "#/$defs/Thresholds"
    },
    "items": {
      "description": "One entry per media id in the publication, in PUBLICATION ORDER. Order is part of the identity: a manifest whose items match by set but not by order describes a different publication, and a verifier comparing sets rather than sequences would accept a reordered book.",
      "type": "array",
      "items": {
        "$ref": "#/$defs/ItemVerdict"
      },
      "minItems": 1
    },
    "decision": {
      "$ref": "#/$defs/ClearanceDecision"
    }
  },
  "$defs": {
    "ClassifierPin": {
      "title": "ClassifierPin",
      "description": "Which model produced these verdicts. A verdict from a model you cannot identify is not evidence, and a verdict produced under a different config is a verdict about a different decision boundary -- score_threshold 0.3 and 0.5 are different classifiers to every consumer.",
      "type": "object",
      "additionalProperties": false,
      "required": [
        "model",
        "ran_at"
      ],
      "properties": {
        "model": {
          "$ref": "common.schema.json#/$defs/ModelRef"
        },
        "ran_at": {
          "$ref": "common.schema.json#/$defs/Timestamp"
        },
        "load_mode": {
          "description": "Which gate the host was running under. A verdict produced by a DEVELOPMENT-mode host -- unpinned weights, unverified licence -- must never clear a real publication, and a verifier serving a release sink must refuse it. Recorded rather than assumed, because 'we were only testing' is how unverified weights reach production.",
          "type": "string",
          "enum": [
            "release",
            "development"
          ]
        }
      }
    },
    "Thresholds": {
      "title": "Thresholds",
      "description": "The decision boundaries actually applied, per class. Recorded rather than referenced because the config can change underneath a stored verdict, and a verdict whose threshold you cannot reconstruct cannot be re-audited.\n\nThe classes are separate on purpose. Collapsing them into one 'nsfw' bit produces the two classic failures: a breastfeeding photo or a post-surgery record treated as pornography, and a bikini holiday photo treated as safe for a public share. A family library contains all three, and the right handling differs for each.",
      "type": "object",
      "additionalProperties": false,
      "required": [
        "explicit",
        "suggestive",
        "medical_or_artistic"
      ],
      "properties": {
        "explicit": {
          "$ref": "common.schema.json#/$defs/Unit"
        },
        "suggestive": {
          "$ref": "common.schema.json#/$defs/Unit"
        },
        "medical_or_artistic": {
          "$ref": "common.schema.json#/$defs/Unit"
        }
      }
    },
    "ItemVerdict": {
      "title": "ItemVerdict",
      "description": "One media id's clearance, bound to the exact bytes that were classified.",
      "type": "object",
      "additionalProperties": false,
      "required": [
        "media_id",
        "evidence_id",
        "verdict"
      ],
      "properties": {
        "media_id": {
          "$ref": "common.schema.json#/$defs/Blake3Hash"
        },
        "evidence_id": {
          "description": "The PROXY the classifier actually saw. Not the media id: a proxy can be regenerated -- a better decoder, a corrected orientation, a different size -- and a verdict about the old proxy is not evidence about the new one. A verifier must confirm this matches the proxy the publication is built from, or treat the verdict as stale, which is indeterminate, which blocks.",
          "$ref": "common.schema.json#/$defs/Blake3Hash"
        },
        "verdict": {
          "description": "`cleared` is the ONLY value that permits automatic publication.\n\n`blocked` means the classifier scored above a threshold. It may be overridden per item by a human, because the classifier does not get a veto over a parent's judgement about their own family.\n\n`indeterminate` means nobody knows: no result row, model unavailable or unloadable, load-gate denial, config digest mismatch, inference error or timeout, or evidence that no longer matches. It may NOT be overridden by anything, because 'nobody checked' is not a decision somebody made.",
          "type": "string",
          "enum": [
            "cleared",
            "blocked",
            "indeterminate"
          ]
        },
        "scores": {
          "description": "Per-class probabilities, when the classifier ran. Null on `indeterminate` -- an indeterminate verdict with scores attached is a contradiction, and the conditional below rejects it.",
          "oneOf": [
            {
              "$ref": "#/$defs/ClassScores"
            },
            {
              "type": "null"
            }
          ]
        },
        "indeterminate_reason": {
          "description": "Why nobody knows. Required on `indeterminate`, because 'blocked for an unknown reason' is unactionable and the remedies differ completely: a missing model needs installing, a stale evidence id needs re-running, a digest mismatch needs investigating.",
          "oneOf": [
            {
              "type": "string",
              "enum": [
                "no_result",
                "model_unavailable",
                "model_unloadable",
                "load_gate_denied",
                "config_digest_mismatch",
                "inference_error",
                "inference_timeout",
                "evidence_stale",
                "verifier_exception"
              ]
            },
            {
              "type": "null"
            }
          ]
        },
        "override": {
          "description": "A human decision to publish despite a `blocked` verdict. Permitted ONLY on `blocked`; the conditional below refuses it on `indeterminate`, which is the single most important rule in this file.",
          "oneOf": [
            {
              "$ref": "#/$defs/Override"
            },
            {
              "type": "null"
            }
          ]
        }
      },
      "allOf": [
        {
          "$comment": "An indeterminate verdict must say why, must carry no scores, and must not be overridable. This is the contract-level expression of 'absence blocks': if it were only enforced in code, one caller passing an override would silently reopen the hole.",
          "if": {
            "properties": {
              "verdict": {
                "const": "indeterminate"
              }
            },
            "required": [
              "verdict"
            ]
          },
          "then": {
            "required": [
              "indeterminate_reason"
            ],
            "properties": {
              "indeterminate_reason": {
                "type": "string"
              },
              "scores": {
                "type": "null"
              },
              "override": {
                "type": "null"
              }
            }
          }
        },
        {
          "$comment": "An override only means anything against a positive result. On a cleared item it would be noise that looks like a decision.",
          "if": {
            "properties": {
              "verdict": {
                "const": "cleared"
              }
            },
            "required": [
              "verdict"
            ]
          },
          "then": {
            "properties": {
              "override": {
                "type": "null"
              }
            }
          }
        },
        {
          "$comment": "A determinate verdict was produced by a model that returned numbers. Requiring them makes a verdict re-auditable against a changed threshold without re-running inference.",
          "if": {
            "properties": {
              "verdict": {
                "enum": [
                  "cleared",
                  "blocked"
                ]
              }
            },
            "required": [
              "verdict"
            ]
          },
          "then": {
            "required": [
              "scores"
            ],
            "properties": {
              "scores": {
                "$ref": "#/$defs/ClassScores"
              }
            }
          }
        }
      ]
    },
    "ClassScores": {
      "title": "ClassScores",
      "type": "object",
      "additionalProperties": false,
      "required": [
        "explicit",
        "suggestive",
        "medical_or_artistic"
      ],
      "properties": {
        "explicit": {
          "$ref": "common.schema.json#/$defs/Unit"
        },
        "suggestive": {
          "$ref": "common.schema.json#/$defs/Unit"
        },
        "medical_or_artistic": {
          "$ref": "common.schema.json#/$defs/Unit"
        }
      }
    },
    "Override": {
      "title": "Override",
      "description": "A recorded human decision. Attributable on purpose: an override that nobody owns is a bypass.",
      "type": "object",
      "additionalProperties": false,
      "required": [
        "decided_at",
        "decided_by",
        "scope"
      ],
      "properties": {
        "decided_at": {
          "$ref": "common.schema.json#/$defs/Timestamp"
        },
        "decided_by": {
          "description": "Local user identifier. Never a service account, never a config value -- a machine cannot consent on a person's behalf about their own photographs.",
          "type": "string",
          "minLength": 1
        },
        "scope": {
          "description": "`item_and_sink` is the only value, deliberately. There is no 'always allow this photo' and no 'always allow this class': a decision to print a photo in a private family book is not a decision to publish it, and the whole design fails if an override can outlive the publication it was made for.",
          "type": "string",
          "const": "item_and_sink"
        },
        "note": {
          "oneOf": [
            {
              "type": "string",
              "maxLength": 1024
            },
            {
              "type": "null"
            }
          ]
        }
      }
    },
    "ClearanceDecision": {
      "title": "ClearanceDecision",
      "description": "The aggregate, derived from `items` and recomputed by every verifier rather than trusted. It is stored so a rejected publication can be explained without re-running anything -- not so a reader can skip checking the items.",
      "type": "object",
      "additionalProperties": false,
      "required": [
        "cleared_for_publication",
        "item_count",
        "cleared_count",
        "blocked_count",
        "indeterminate_count"
      ],
      "properties": {
        "cleared_for_publication": {
          "description": "True only when EVERY item is `cleared`, or is `blocked` with a valid override for this sink. One indeterminate item denies the whole publication -- a book is printed as a unit and a share is published as a unit, so partial clearance is not a state either can be in.",
          "type": "boolean"
        },
        "item_count": {
          "type": "integer",
          "minimum": 1
        },
        "cleared_count": {
          "type": "integer",
          "minimum": 0
        },
        "blocked_count": {
          "type": "integer",
          "minimum": 0
        },
        "indeterminate_count": {
          "type": "integer",
          "minimum": 0
        },
        "denied_reason": {
          "oneOf": [
            {
              "type": "string",
              "maxLength": 1024
            },
            {
              "type": "null"
            }
          ]
        }
      },
      "allOf": [
        {
          "$comment": "The one arithmetic invariant worth encoding: a publication cannot be cleared while any item is indeterminate. Stated here as well as in prose because this is the rule everything else in the file exists to protect, and a schema that permits the contradiction invites an implementation that produces it.",
          "if": {
            "properties": {
              "cleared_for_publication": {
                "const": true
              }
            },
            "required": [
              "cleared_for_publication"
            ]
          },
          "then": {
            "properties": {
              "indeterminate_count": {
                "const": 0
              }
            }
          }
        }
      ]
    }
  }
}
