{
  "schema_version": "v0",
  "manifest_version": 1,
  "created_at": "2026-08-16T18:02:00Z",
  "sink": "print",
  "sink_detail": "family album",
  "classifier": {
    "model": {
      "model_id": "nsfw-siglip-head",
      "version": "1.0.0",
      "weights_blake3": "dddddddddddddddddddddddddddddddddddddddddddddddddddddddddddddddd",
      "config_blake3": "cccccccccccccccccccccccccccccccccccccccccccccccccccccccccccccccc",
      "runtime": "onnxruntime_coreml",
      "precision": "fp32"
    },
    "ran_at": "2026-08-16T18:00:00Z",
    "load_mode": "release"
  },
  "thresholds": {
    "explicit": 0.3,
    "suggestive": 0.3,
    "medical_or_artistic": 0.3
  },
  "items": [
    {
      "media_id": "4444444444444444444444444444444444444444444444444444444444444444",
      "evidence_id": "dddddddddddddddddddddddddddddddddddddddddddddddddddddddddddddddd",
      "verdict": "blocked",
      "scores": {
        "explicit": 0.05,
        "suggestive": 0.2,
        "medical_or_artistic": 0.71
      },
      "override": {
        "decided_at": "2026-08-16T18:01:55Z",
        "decided_by": "local:rohan",
        "scope": "item_and_sink",
        "note": "breastfeeding photo, scored medical_or_artistic; belongs in the family book"
      }
    }
  ],
  "decision": {
    "cleared_for_publication": true,
    "item_count": 1,
    "cleared_count": 0,
    "blocked_count": 1,
    "indeterminate_count": 0,
    "denied_reason": null
  },
  "manifest_id": "937515a01b92f7251a9370c1c29bd9e70af5dbbc9e58c92e83656e020a79c668"
}
